[
  {
    "id": "ODD.INIT.AGENT",
    "stage": "initialisation",
    "label": {
      "en": "Agent and task state",
      "ro": "Agent și starea sarcinii"
    },
    "description": {
      "en": "Create the HumanAgent state, prior belief and default memory/reliability states used by M0.",
      "ro": "Creează starea HumanAgent, convingerea inițială și stările implicite de memorie/fiabilitate folosite de M0."
    },
    "code_ref": "src/cognitive_epistemic_model/state.py",
    "status": "implemented_m0"
  },
  {
    "id": "ODD.INIT.PARAMS",
    "stage": "initialisation",
    "label": {
      "en": "Reference parameters",
      "ro": "Parametri de referință"
    },
    "description": {
      "en": "Load demonstrative ModelParams. They are not population estimates.",
      "ro": "Încarcă ModelParams demonstrativi. Nu sunt estimări populaționale."
    },
    "code_ref": "src/cognitive_epistemic_model/state.py",
    "status": "implemented_m0"
  },
  {
    "id": "ODD.PROCESS.SCHEDULE",
    "stage": "submodel",
    "label": {
      "en": "Event scheduling",
      "ro": "Programarea evenimentelor"
    },
    "description": {
      "en": "Order events by abstract time while preserving input order for simultaneous events.",
      "ro": "Ordonează evenimentele după timpul abstract, păstrând ordinea de intrare pentru evenimente simultane."
    },
    "code_ref": "src/cognitive_epistemic_model/simulation.py",
    "status": "implemented_m0"
  },
  {
    "id": "ODD.PROCESS.EXPOSURE",
    "stage": "submodel",
    "label": {
      "en": "Exposure / familiarity update",
      "ro": "Expunere / actualizarea familiarității"
    },
    "description": {
      "en": "Exposure events update claim familiarity with bounded saturation.",
      "ro": "Evenimentele de expunere actualizează familiaritatea afirmației cu saturație mărginită."
    },
    "code_ref": "src/cognitive_epistemic_model/updates.py",
    "status": "implemented_m0"
  },
  {
    "id": "ODD.PROCESS.CORRECTION",
    "stage": "submodel",
    "label": {
      "en": "Corrective-context update",
      "ro": "Actualizarea contextului corectiv"
    },
    "description": {
      "en": "Correction events increase corrective-context accessibility; accessibility then decays with abstract elapsed time.",
      "ro": "Evenimentele de corecție cresc accesibilitatea contextului corectiv; accesibilitatea se diminuează apoi cu timpul abstract scurs."
    },
    "code_ref": "src/cognitive_epistemic_model/updates.py",
    "status": "implemented_m0"
  },
  {
    "id": "ODD.PROCESS.SOURCE",
    "stage": "submodel",
    "label": {
      "en": "Source-reliability learning",
      "ro": "Învățarea fiabilității sursei"
    },
    "description": {
      "en": "Feedback updates the agent's task-relevant estimate of source reliability.",
      "ro": "Feedbackul actualizează estimarea agentului privind fiabilitatea sursei relevantă pentru sarcină."
    },
    "code_ref": "src/cognitive_epistemic_model/updates.py",
    "status": "implemented_m0"
  },
  {
    "id": "ODD.PROCESS.BELIEF",
    "stage": "submodel",
    "label": {
      "en": "Belief update",
      "ro": "Actualizarea convingerii"
    },
    "description": {
      "en": "Prior belief, familiarity, source-weighted evidence and corrective context enter the M0 belief transform. Ground truth is not passed directly into this update.",
      "ro": "Convingerea inițială, familiaritatea, evidența ponderată de sursă și contextul corectiv intră în transformarea M0 a convingerii. Adevărul nu este introdus direct în această actualizare."
    },
    "code_ref": "src/cognitive_epistemic_model/model.py",
    "status": "implemented_m0"
  },
  {
    "id": "ODD.PROCESS.ACTION",
    "stage": "submodel",
    "label": {
      "en": "Action policy",
      "ro": "Politica de acțiune"
    },
    "description": {
      "en": "Accuracy weight, belief and contextual reward determine sharing probability; a seeded stochastic draw generates Share.",
      "ro": "Ponderea acurateții, convingerea și recompensa contextuală determină probabilitatea de distribuire; o extragere stochastică cu seed generează Share."
    },
    "code_ref": "src/cognitive_epistemic_model/model.py",
    "status": "implemented_m0"
  },
  {
    "id": "ODD.OBS.LOG",
    "stage": "observation",
    "label": {
      "en": "Event and outcome log",
      "ro": "Jurnal de evenimente și rezultate"
    },
    "description": {
      "en": "Record the realised events, latent outputs and stochastic sharing outcome for replay and validation.",
      "ro": "Înregistrează evenimentele realizate, ieșirile latente și rezultatul stochastic al distribuirii pentru replay și validare."
    },
    "code_ref": "src/cognitive_epistemic_model/simulation.py",
    "status": "implemented_m0"
  },
  {
    "id": "ODD.OBS.PATTERNS",
    "stage": "observation",
    "label": {
      "en": "Scientific pattern tests",
      "ro": "Teste de pattern științific"
    },
    "description": {
      "en": "Evaluate the four M0 target patterns separately from software correctness.",
      "ro": "Evaluează cele patru patternuri-țintă M0 separat de corectitudinea software."
    },
    "code_ref": "tests/test_patterns.py",
    "status": "implemented_m0"
  },
  {
    "id": "ODD.SCALE.TIME",
    "stage": "scale",
    "label": {
      "en": "Time",
      "ro": "Timp"
    },
    "description": {
      "en": "Discrete abstract event steps; not days, months or years.",
      "ro": "Pași discreți abstracți ai evenimentelor; nu zile, luni sau ani."
    },
    "code_ref": "src/cognitive_epistemic_model/events.py",
    "status": "implemented_m0"
  },
  {
    "id": "ODD.SCALE.LEVELS",
    "stage": "scale",
    "label": {
      "en": "Entity levels",
      "ro": "Niveluri de entitate"
    },
    "description": {
      "en": "Current M0 reference runs operate at agent, claim/item and source levels.",
      "ro": "Rulările de referință M0 actuale operează la nivel de agent, afirmație/item și sursă."
    },
    "code_ref": "src/cognitive_epistemic_model/simulation.py",
    "status": "implemented_m0"
  },
  {
    "id": "ODD.M1.PROCESS.EDITORIAL_SELECTION",
    "stage": "submodel",
    "label": {
      "en": "Editorial emphasis selection",
      "ro": "Selecția prin accent editorial"
    },
    "description": {
      "en": "Select a bounded sample from one fixed fact-compatible event pool using a transparent negative/neutral/positive reference emphasis policy.",
      "ro": "Selectează un eșantion limitat din același pool factual compatibil folosind o politică transparentă de accent negativ/neutru/pozitiv."
    },
    "code_ref": "src/cognitive_epistemic_model/editorial.py",
    "status": "candidate"
  },
  {
    "id": "ODD.M1.PROCESS.ISSUE_APPRAISAL",
    "stage": "submodel",
    "label": {
      "en": "Issue-appraisal update",
      "ro": "Actualizarea evaluării subiectului"
    },
    "description": {
      "en": "Map the observed sample balance into a bounded issue-appraisal state using an uncalibrated reference gain; this is distinct from claim belief B.",
      "ro": "Mapează balanța eșantionului observat într-o stare mărginită de evaluare a subiectului folosind un câștig de referință necalibrat; aceasta este distinctă de convingerea B."
    },
    "code_ref": "src/cognitive_epistemic_model/editorial.py",
    "status": "candidate"
  },
  {
    "id": "ODD.M1.OBS.EDITORIAL_PATTERN",
    "stage": "observation",
    "label": {
      "en": "M1 editorial-emphasis pattern",
      "ro": "Pattern M1 de accent editorial"
    },
    "description": {
      "en": "Check selective factual emphasis and its nested null model while retaining all M0 scientific regression patterns.",
      "ro": "Verifică accentul factual selectiv și modelul-null nested, păstrând toate patternurile științifice M0."
    },
    "code_ref": "tests/test_m1_editorial.py",
    "status": "candidate"
  },
  {
    "id": "ODD.M1.PROCESS.PRESENTATION_FRAME",
    "stage": "submodel",
    "label": {
      "en": "Semantic-equivalent presentation framing",
      "ro": "Framing de prezentare semantic echivalent"
    },
    "description": {
      "en": "Hold proposition meaning and factual compatibility fixed while rendering confirmation versus refutation frames.",
      "ro": "Menține sensul propoziției și compatibilitatea factuală fixe, schimbând numai cadrul confirmation versus refutation."
    },
    "code_ref": "src/cognitive_epistemic_model/presentation.py",
    "status": "candidate"
  },
  {
    "id": "ODD.M1.PROCESS.CONGRUENCE",
    "stage": "submodel",
    "label": {
      "en": "Prior-attitude congruence",
      "ro": "Congruența cu atitudinea anterioară"
    },
    "description": {
      "en": "Derive task-specific message–prior-attitude congruence without introducing a stable ideology or party-identity trait.",
      "ro": "Derivă congruența task-specifică dintre mesaj și atitudinea anterioară fără a introduce o trăsătură stabilă de ideologie sau identitate de partid."
    },
    "code_ref": "src/cognitive_epistemic_model/presentation.py",
    "status": "candidate"
  },
  {
    "id": "ODD.M1.PROCESS.ENGAGEMENT_MODELS",
    "stage": "submodel",
    "label": {
      "en": "Nested engagement models",
      "ro": "Modele nested de engagement"
    },
    "description": {
      "en": "Compare presentation-normalized NULL, frame-only, and frame×congruence logistic reference models.",
      "ro": "Compară modelele de referință logistic NULL cu prezentarea normalizată, frame-only și frame×congruence."
    },
    "code_ref": "src/cognitive_epistemic_model/presentation.py",
    "status": "candidate"
  },
  {
    "id": "ODD.M1.OBS.PRESENTATION_PATTERN",
    "stage": "observation",
    "label": {
      "en": "M1 presentation-framing discrimination",
      "ro": "Discriminarea framingului de prezentare M1"
    },
    "description": {
      "en": "Check semantic-equivalence, framing direction, congruence moderation and separation from M0 Share.",